{
  "$schema": "https://json-schema.org/draft/2020-12/schema",
  "$id": "urn:archflow:schema:v1:rubric",
  "type": "object", "additionalProperties": false,
  "required": ["schema_version", "kind", "mode", "criteria"],
  "properties": {
    "schema_version": { "const": "1" }, "kind": { "enum": ["artifact", "implementation"] }, "mode": { "enum": ["adversarial"] },
    "criteria": { "type": "array", "minItems": 1, "uniqueItems": true, "x-archflow-unique-by": "id", "items": { "type": "object", "additionalProperties": false, "required": ["id", "text", "blocking"], "properties": { "id": { "type": "string", "pattern": "^[a-z][a-z0-9]*(?:-[a-z0-9]+)*$" }, "text": { "type": "string", "minLength": 1, "pattern": "\\S" }, "blocking": { "type": "boolean" } } } }
  }
}
